{
  "schema_version": 2,
  "case_id": "zh-en-contemporary-032",
  "revision": 1,
  "status": "ready",
  "task": "literary-translation-quality",
  "source_language": "zh",
  "target_language": "en",
  "source_file": "../../../fixtures/manuscripts/contemporary-messenger-rna/passage-032/source.zh.txt",
  "source_metadata_file": "../../../fixtures/manuscripts/contemporary-messenger-rna/passage-032/passage.json",
  "source_revision": 1,
  "group_id": "contemporary-messenger-rna",
  "passage_id": "contemporary-messenger-rna-passage-032",
  "rubric_id": "literary-translation-quality-v1",
  "context": {
    "brief": null
  },
  "candidates": [
    {
      "candidate_id": "c-211166d011824e4f",
      "revision": 1,
      "translation_file": "candidates/c-211166d011824e4f.en.txt",
      "status": "ready",
      "provenance": {
        "usage_rights": "permitted",
        "license": "CC BY-SA 3.0",
        "license_url": "https://creativecommons.org/licenses/by-sa/3.0/",
        "attribution": "“信使RNA” / Messenger RNA, by leather_boots. Translation: Not separately named in the retrieved credit box; see linked English page history and retained credits. CC BY-SA 3.0. Sources: https://scp-cn.wiki/messenger-rna and http://scp-int.wikidot.com/messenger-rna.",
        "license_evidence": "CC BY-SA 3.0 link found on both retrieved source pages; original HTML retained in source_cache.",
        "corpus_collection": "contemporary_corpus",
        "corpus_record_id": "contemporary-032",
        "source_work_id": "messenger-rna",
        "retrieved_date": "2026-10-19",
        "modifications": "Imported verbatim from contemporary_pairs.jsonl; no additional wording or normalization changes.",
        "translation_origin": "published English translation",
        "translator": "Not separately named in the retrieved credit box; see linked English page history and retained credits.",
        "title_en": "Messenger RNA",
        "source_url": "http://scp-int.wikidot.com/messenger-rna",
        "english_history_url": "http://scp-int.wikidot.com/messenger-rna/history",
        "source_credits": [
          "‡ Licensing / Citation ‡ Hide Licensing / Citation Cite this page as: \" Messenger RNA \" by leather_boots, from the SCP Wiki . Source: https://scpwiki.com/messenger-rna . Licensed under CC BY-SA . For information on how to use this component, see the License Box component . To read about licensing policy, see the Licensing Guide ."
        ],
        "source_snapshot_sha256": "349618fe0436cc9be0f6b5946e84285479223eaa6af583f76711ec2a7d245b16",
        "extracted_block_range_exclusive": [
          43,
          88
        ],
        "english_word_count": 693,
        "selection_type": "complete_scene_or_story",
        "corpus_review": {
          "reviewer": "Codex (AI)",
          "date": "2026-10-19",
          "boundary_rationale": "The complete rainy-night first meeting of Connor and Serena.",
          "alignment": "Passage-level alignment of the published translation with its Chinese original. Not a sentence-aligned or human-certified corpus.",
          "normalization": "HTML removed; paragraph and scene breaks preserved; credit widgets, navigation and footnote markers excluded. Source wording retained, including translation quirks. Unrendered formatting/image directives omitted; no images collected.",
          "context": "An excerpt may use characters and terms established elsewhere in the source or SCP shared universe."
        }
      }
    },
    {
      "candidate_id": "c-62f65e3b20c54bd8",
      "revision": 1,
      "translation_file": "candidates/c-62f65e3b20c54bd8.en.txt",
      "status": "ready",
      "provenance": {
        "translation_origin": "synthetic model translation",
        "purpose": "minimal-prompt adverse-candidate pool",
        "quality_status": "unreviewed; degradation is not assumed",
        "requested_model": "azure/openai/gpt-4.1-mini",
        "returned_model": "azure/openai/gpt-4.1-mini",
        "non_reasoning_model": true,
        "instruction": "translate the Chinese to English",
        "generation_settings": {
          "temperature": 0,
          "max_tokens": 6000
        },
        "request_sha256": "3a6a524b06d0172a2130ad65e4e6f15e98397b1f8a3791f58ca4915471a7b394",
        "response_id": "chatcmpl-EbbEhEgxXU1Fxz1OuCseqIbPXTmNO",
        "generated_at": "2026-10-22T00:46:19+00:00",
        "usage": {
          "completion_tokens": 991,
          "prompt_tokens": 1147,
          "total_tokens": 2138,
          "completion_tokens_details": {
            "accepted_prediction_tokens": 0,
            "audio_tokens": 0,
            "reasoning_tokens": 0,
            "rejected_prediction_tokens": 0
          },
          "prompt_tokens_details": {
            "audio_tokens": 0,
            "cached_tokens": 0
          },
          "latency_checkpoint": {
            "engine_tbt_ms": 7,
            "engine_ttft_ms": 172,
            "engine_ttlt_ms": 6899,
            "pre_inference_ms": 88,
            "service_tbt_ms": 7,
            "service_ttft_ms": 332,
            "service_ttlt_ms": 7051,
            "user_visible_ttft_ms": 244
          }
        },
        "generation_artifacts": "results/synthetic-translations-p_5iw50i/zh-en-contemporary-032",
        "task_id": "5ca63d4c4f7e00ac4453bde815ee9b2ddda51f04b7ed01cc4d86b5587ecf3c14",
        "source_revision": 1,
        "source_sha256": "4ede33e131f1d6892583e22d9030e01239fb8c4412adac04c431caa9b7b3c280",
        "translation_sha256": "3714e01bcd65e8e1f916d0e260a4ce48db0127e88331763fc23547f3e0c2576a",
        "usage_rights": "permitted",
        "attribution": "Chinese source: “信使RNA”; author: leather_boots; https://scp-cn.wiki/messenger-rna. Synthetic English translation generated with azure/openai/gpt-4.1-mini.",
        "license": "CC BY-SA 3.0",
        "license_url": "https://creativecommons.org/licenses/by-sa/3.0/"
      }
    }
  ],
  "translation_instructions": null
}
