{
  "schema_version": 2,
  "case_id": "zh-en-contemporary-035",
  "revision": 1,
  "status": "ready",
  "task": "literary-translation-quality",
  "source_language": "zh",
  "target_language": "en",
  "source_file": "../../../fixtures/manuscripts/contemporary-scplive-nine-days-monologue/passage-035/source.zh.txt",
  "source_metadata_file": "../../../fixtures/manuscripts/contemporary-scplive-nine-days-monologue/passage-035/passage.json",
  "source_revision": 1,
  "group_id": "contemporary-scplive-nine-days-monologue",
  "passage_id": "contemporary-scplive-nine-days-monologue-passage-035",
  "rubric_id": "literary-translation-quality-v1",
  "context": {
    "brief": null
  },
  "candidates": [
    {
      "candidate_id": "c-159b1d3373b54ef5",
      "revision": 1,
      "translation_file": "candidates/c-159b1d3373b54ef5.en.txt",
      "status": "ready",
      "provenance": {
        "usage_rights": "permitted",
        "license": "CC BY-SA 3.0",
        "license_url": "https://creativecommons.org/licenses/by-sa/3.0/",
        "attribution": "SCPLIVE! 九日独白 个人专辑及角色PV / SCPLIVE! Nine Days Monologue - Solo Albums and Character PVs, by InitializerCOX (script); character design by breaddddd; edited and translated by la kanro. Translation: la kanro CC BY-SA 3.0. Sources: https://scp-cn.wiki/scplive-nine-days-monologue and https://scp-int.wikidot.com/scplive-nine-days-monologue.",
        "license_evidence": "CC BY-SA 3.0 link found on both retrieved source pages; original HTML retained in source_cache.",
        "corpus_collection": "contemporary_corpus",
        "corpus_record_id": "contemporary-035",
        "source_work_id": "scplive-nine-days-monologue",
        "retrieved_date": "2026-10-19",
        "modifications": "Imported verbatim from contemporary_pairs.jsonl; no additional wording or normalization changes.",
        "translation_origin": "published English translation",
        "translator": "la kanro",
        "title_en": "SCPLIVE! Nine Days Monologue - Solo Albums and Character PVs",
        "source_url": "https://scp-int.wikidot.com/scplive-nine-days-monologue",
        "english_history_url": "https://scp-int.wikidot.com/scplive-nine-days-monologue/history",
        "source_credits": [
          "rating: +2 + – x close Credits Credits & Thanks (in alphabetical order) Character Designer: breaddddd Scriptwriter: InitializerCOX does not match any existing user name Editor & Translator: la kanro CSS Designer: Zihao Huang Author Pages for Original Characters Ayaka Saibara Bread Comix Eleanor Empira Misaka Scarlet And others who have contributed to SCPLive! Foundation Idol Project! Image Storage: SCP-JP File Storage close",
          "‡ Licensing / Citation ‡ Hide Licensing / Citation Cite this page as: \" SCPLIVE! Nine Days Monologue - Solo Albums and Character PVs \" {$contributors}, from SCP International . Source: https://scpint.org/scplive-nine-days-monologue . Licensed under CC-BY-SA . For more information, see Licensing Guide (hosted on EN). Licensing Disclosures Filename: kanro Name: kanro Author: initializerCOX does not match any existing user name License: CC BY-SA 3.0 Source Link: http://scpsandboxcn.wikidot.com/girls-frontline/ Filename: jane-simple.jpg Name: ジェイン・シンプル Author: breaddddd License: CC BY-SA 3.0 Source Link: http://scp-jp-storage.wikidot.com/file:3741648-11-vm7j Filename: karina-valentinovna-savitskaya.jpg Name: カリーナ・ワレンチノヴナ・サビツカヤ Author: breaddddd License: CC BY-SA 3.0 Source Link: http://scp-jp-storage.wikidot.com/file:3741648-12-ofnk Filename: misaka.jpg Name: ミサカ Author: breaddddd License: CC BY-SA 3.0 Source Link: http://scp-jp-storage.wikidot.com/file:3741648-13-ayqz Filename: ayaka-saibara.jpg Name: 催馬楽 綾香 Author: breaddddd License: CC BY-SA 3.0 Source Link: http://scp-jp-storage.wikidot.com/file:3741648-13-xa0p Filename: eleanor-ursula-empira.jpg Name: エレノア・アーシュラ・エンパイラ Author: breaddddd License: CC BY-SA 3.0 Source Link: http://scp-jp-storage.wikidot.com/file:3741648-12-t8yf Filename: bread.jpg Name: ブレッド Author: breaddddd License: CC BY-SA 3.0 Source Link: http://scp-jp-storage.wikidot.com/file:3741648-13-o2es Filename: scarlet.jpg Name: スカーレット Author: breaddddd License: CC BY-SA 3.0 Source Link: http://scp-jp-storage.wikidot.com/file:3741648-21-r18o Filename: comix.jpg Name: コミックス Author: breaddddd License: CC BY-SA 3.0 Source Link: http://scp-jp-storage.wikidot.com/file:3741648-20-n2m2 Filename: frisch.jpg Name: フリッシュ Author: breaddddd License: CC BY-SA 3.0 Source Link: http://scp-jp-storage.wikidot.com/file:3741648-19-v9lw Filename: aic-comix-angry.PNG Name: AIC Author: breaddddd License: CC BY-SA 3.0 Source Link: http://scp-wiki-cn.wikidot.com/breaddddd-art-aic#toc14 Additional Notes: The file used in the article is tailored by initializerCOX does not match any existing user name ."
        ],
        "source_snapshot_sha256": "26112ed65075e12961791eb28afe9235f9f02ece135f2e14e5465080c3639aa5",
        "extracted_block_range_exclusive": [
          8,
          19
        ],
        "english_word_count": 531,
        "selection_type": "complete_scene_or_story",
        "corpus_review": {
          "reviewer": "Codex (AI)",
          "date": "2026-10-19",
          "boundary_rationale": "The complete Jane vignette, ending with her description of her anomalous ability.",
          "alignment": "Passage-level alignment of the published translation with its Chinese original. Not a sentence-aligned or human-certified corpus.",
          "normalization": "HTML removed; paragraph and scene breaks preserved; credit widgets, navigation and footnote markers excluded. Source wording retained, including translation quirks. Unrendered formatting/image directives omitted; no images collected.",
          "context": "An excerpt may use characters and terms established elsewhere in the source or SCP shared universe."
        }
      }
    },
    {
      "candidate_id": "c-5359ff421ef64668",
      "revision": 1,
      "translation_file": "candidates/c-5359ff421ef64668.en.txt",
      "status": "ready",
      "provenance": {
        "translation_origin": "synthetic model translation",
        "purpose": "minimal-prompt adverse-candidate pool",
        "quality_status": "unreviewed; degradation is not assumed",
        "requested_model": "azure/openai/gpt-4.1-mini",
        "returned_model": "azure/openai/gpt-4.1-mini",
        "non_reasoning_model": true,
        "instruction": "translate the Chinese to English",
        "generation_settings": {
          "temperature": 0,
          "max_tokens": 6000
        },
        "request_sha256": "932b59c4a6430b6f56c69a4a85208269868d03be9d455e0f364821a15521b978",
        "response_id": "chatcmpl-EbbEoS16db9WICiV6PiRUs6eF0B0h",
        "generated_at": "2026-10-22T00:46:26+00:00",
        "usage": {
          "completion_tokens": 661,
          "prompt_tokens": 759,
          "total_tokens": 1420,
          "completion_tokens_details": {
            "accepted_prediction_tokens": 0,
            "audio_tokens": 0,
            "reasoning_tokens": 0,
            "rejected_prediction_tokens": 0
          },
          "prompt_tokens_details": {
            "audio_tokens": 0,
            "cached_tokens": 0
          },
          "latency_checkpoint": {
            "engine_tbt_ms": 7,
            "engine_ttft_ms": 35,
            "engine_ttlt_ms": 4849,
            "pre_inference_ms": 100,
            "service_tbt_ms": 7,
            "service_ttft_ms": 373,
            "service_ttlt_ms": 5232,
            "user_visible_ttft_ms": 273
          }
        },
        "generation_artifacts": "results/synthetic-translations-p_5iw50i/zh-en-contemporary-035",
        "task_id": "9e762988a76f8f9552316902ec6f6a09fe83c2331540f5cab36c91cdf0b83d30",
        "source_revision": 1,
        "source_sha256": "2b500fa098978a15cb2316d971846987cbd7f8483815b6121897d7189724f811",
        "translation_sha256": "c825264b0e82565c5d9fa868cf33bb9232b53ced64e78f5c52431a7b8e9f9f22",
        "usage_rights": "permitted",
        "attribution": "Chinese source: SCPLIVE! 九日独白 个人专辑及角色PV; author: InitializerCOX (script); character design by breaddddd; edited and translated by la kanro; https://scp-cn.wiki/scplive-nine-days-monologue. Synthetic English translation generated with azure/openai/gpt-4.1-mini.",
        "license": "CC BY-SA 3.0",
        "license_url": "https://creativecommons.org/licenses/by-sa/3.0/"
      }
    }
  ],
  "translation_instructions": null
}
