{
  "schema_version": 2,
  "case_id": "zh-en-contemporary-022",
  "revision": 1,
  "status": "ready",
  "task": "literary-translation-quality",
  "source_language": "zh",
  "target_language": "en",
  "source_file": "../../../fixtures/manuscripts/contemporary-sayonara-heaven/passage-022/source.zh.txt",
  "source_metadata_file": "../../../fixtures/manuscripts/contemporary-sayonara-heaven/passage-022/passage.json",
  "source_revision": 1,
  "group_id": "contemporary-sayonara-heaven",
  "passage_id": "contemporary-sayonara-heaven-passage-022",
  "rubric_id": "literary-translation-quality-v1",
  "context": {
    "brief": null
  },
  "candidates": [
    {
      "candidate_id": "c-e33e23f07bd74f11",
      "revision": 1,
      "translation_file": "candidates/c-e33e23f07bd74f11.en.txt",
      "status": "ready",
      "provenance": {
        "translation_origin": "synthetic model translation",
        "purpose": "minimal-prompt adverse-candidate pool",
        "quality_status": "unreviewed; degradation is not assumed",
        "requested_model": "azure/openai/gpt-4.1-mini",
        "returned_model": "azure/openai/gpt-4.1-mini",
        "non_reasoning_model": true,
        "instruction": "translate the Chinese to English",
        "generation_settings": {
          "temperature": 0,
          "max_tokens": 6000
        },
        "request_sha256": "0e66640f035b712f4c250327ed1c9c3bd54aa25ca76c9679df7370b409459f71",
        "response_id": "chatcmpl-EbbELQeTdi9W1teTRSywDL08RCnyi",
        "generated_at": "2026-10-22T00:45:57+00:00",
        "usage": {
          "completion_tokens": 666,
          "prompt_tokens": 820,
          "total_tokens": 1486,
          "completion_tokens_details": {
            "accepted_prediction_tokens": 0,
            "audio_tokens": 0,
            "reasoning_tokens": 0,
            "rejected_prediction_tokens": 0
          },
          "prompt_tokens_details": {
            "audio_tokens": 0,
            "cached_tokens": 0
          },
          "latency_checkpoint": {
            "engine_tbt_ms": 7,
            "engine_ttft_ms": 31,
            "engine_ttlt_ms": 4891,
            "pre_inference_ms": 111,
            "service_tbt_ms": 7,
            "service_ttft_ms": 190,
            "service_ttlt_ms": 5045,
            "user_visible_ttft_ms": 79
          }
        },
        "generation_artifacts": "results/synthetic-translations-p_5iw50i/zh-en-contemporary-022",
        "task_id": "d3ee85453fd31f6f9b104687eeaab32e27b816c77956600f856e8156f5666bb4",
        "source_revision": 1,
        "source_sha256": "086a8ceb203bd18fa395a2a4006ef3dd53710ab97261fd6993369b2e698b57b9",
        "translation_sha256": "5d05060761a58a6893e4fe4240127e617ab70e79097ad1265d62419a5527138d",
        "usage_rights": "permitted",
        "attribution": "Chinese source: 告別樂土; author: MScarlet; https://scp-cn.wiki/sayonara-heaven. Synthetic English translation generated with azure/openai/gpt-4.1-mini.",
        "license": "CC BY-SA 3.0",
        "license_url": "https://creativecommons.org/licenses/by-sa/3.0/"
      }
    },
    {
      "candidate_id": "c-e456e269e39e467d",
      "revision": 1,
      "translation_file": "candidates/c-e456e269e39e467d.en.txt",
      "status": "ready",
      "provenance": {
        "usage_rights": "permitted",
        "license": "CC BY-SA 3.0",
        "license_url": "https://creativecommons.org/licenses/by-sa/3.0/",
        "attribution": "告別樂土 / Sayonara Heaven, by MScarlet. Translation: Not separately named in the retrieved credit box; see linked English page history and retained credits. CC BY-SA 3.0. Sources: https://scp-cn.wiki/sayonara-heaven and https://scp-int.wikidot.com/sayonara-heaven.",
        "license_evidence": "CC BY-SA 3.0 link found on both retrieved source pages; original HTML retained in source_cache.",
        "corpus_collection": "contemporary_corpus",
        "corpus_record_id": "contemporary-022",
        "source_work_id": "sayonara-heaven",
        "retrieved_date": "2026-10-19",
        "modifications": "Imported verbatim from contemporary_pairs.jsonl; no additional wording or normalization changes.",
        "translation_origin": "published English translation",
        "translator": "Not separately named in the retrieved credit box; see linked English page history and retained credits.",
        "title_en": "Sayonara Heaven",
        "source_url": "https://scp-int.wikidot.com/sayonara-heaven",
        "english_history_url": "https://scp-int.wikidot.com/sayonara-heaven/history",
        "source_credits": [],
        "source_snapshot_sha256": "837884281e0562779b07d854bf1aae57451523bece790fad579196022a42cab5",
        "extracted_block_range_exclusive": [
          0,
          18
        ],
        "english_word_count": 541,
        "selection_type": "complete_scene_or_story",
        "corpus_review": {
          "reviewer": "Codex (AI)",
          "date": "2026-10-19",
          "boundary_rationale": "The complete principal's address and closing exchange, excluding the navigation link.",
          "alignment": "Passage-level alignment of the published translation with its Chinese original. Not a sentence-aligned or human-certified corpus.",
          "normalization": "HTML removed; paragraph and scene breaks preserved; credit widgets, navigation and footnote markers excluded. Source wording retained, including translation quirks. Unrendered formatting/image directives omitted; no images collected.",
          "context": "An excerpt may use characters and terms established elsewhere in the source or SCP shared universe."
        }
      }
    }
  ],
  "translation_instructions": null
}
