{
  "schema_version": 2,
  "case_id": "zh-en-contemporary-038",
  "revision": 1,
  "status": "ready",
  "task": "literary-translation-quality",
  "source_language": "zh",
  "target_language": "en",
  "source_file": "../../../fixtures/manuscripts/contemporary-wallisbroken/passage-038/source.zh.txt",
  "source_metadata_file": "../../../fixtures/manuscripts/contemporary-wallisbroken/passage-038/passage.json",
  "source_revision": 1,
  "group_id": "contemporary-wallisbroken",
  "passage_id": "contemporary-wallisbroken-passage-038",
  "rubric_id": "literary-translation-quality-v1",
  "context": {
    "brief": null
  },
  "candidates": [
    {
      "candidate_id": "c-082c5515959e4550",
      "revision": 1,
      "translation_file": "candidates/c-082c5515959e4550.en.txt",
      "status": "ready",
      "provenance": {
        "usage_rights": "permitted",
        "license": "CC BY-SA 3.0",
        "license_url": "https://creativecommons.org/licenses/by-sa/3.0/",
        "attribution": "破壁行动 / Breaking the wall, by Meltyland Nightmare. Translation: Not separately named in the retrieved credit box; see linked English page history and retained credits. CC BY-SA 3.0. Sources: https://scp-cn.wiki/wallisbroken and http://scp-int.wikidot.com/wallisbroken.",
        "license_evidence": "CC BY-SA 3.0 link found on both retrieved source pages; original HTML retained in source_cache.",
        "corpus_collection": "contemporary_corpus",
        "corpus_record_id": "contemporary-038",
        "source_work_id": "wallisbroken",
        "retrieved_date": "2026-10-19",
        "modifications": "Imported verbatim from contemporary_pairs.jsonl; no additional wording or normalization changes.",
        "translation_origin": "published English translation",
        "translator": "Not separately named in the retrieved credit box; see linked English page history and retained credits.",
        "title_en": "Breaking the wall",
        "source_url": "http://scp-int.wikidot.com/wallisbroken",
        "english_history_url": "http://scp-int.wikidot.com/wallisbroken/history",
        "source_credits": [
          "rating: +3 + – x",
          "著作信息 The author of this article is Meltyland Nightmare . For more works by this author, see Leader Researcher Zu Ling's personnel page. rating: +3 + – x"
        ],
        "source_snapshot_sha256": "7b79476fa1842d096cd6c3c2856945eec580a01601b2fdd66bc87ff7067b3101",
        "extracted_block_range_exclusive": [
          16,
          38
        ],
        "english_word_count": 620,
        "selection_type": "complete_scene_or_story",
        "corpus_review": {
          "reviewer": "Codex (AI)",
          "date": "2026-10-19",
          "boundary_rationale": "A complete planning sequence from assessing the narrators to obtaining outside help and uploading the call record.",
          "alignment": "Passage-level alignment of the published translation with its Chinese original. Not a sentence-aligned or human-certified corpus.",
          "normalization": "HTML removed; paragraph and scene breaks preserved; credit widgets, navigation and footnote markers excluded. Source wording retained, including translation quirks. Unrendered formatting/image directives omitted; no images collected.",
          "context": "An excerpt may use characters and terms established elsewhere in the source or SCP shared universe."
        }
      }
    },
    {
      "candidate_id": "c-6b215212f7fb4953",
      "revision": 1,
      "translation_file": "candidates/c-6b215212f7fb4953.en.txt",
      "status": "ready",
      "provenance": {
        "translation_origin": "synthetic model translation",
        "purpose": "minimal-prompt adverse-candidate pool",
        "quality_status": "unreviewed; degradation is not assumed",
        "requested_model": "azure/openai/gpt-4.1-mini",
        "returned_model": "azure/openai/gpt-4.1-mini",
        "non_reasoning_model": true,
        "instruction": "translate the Chinese to English",
        "generation_settings": {
          "temperature": 0,
          "max_tokens": 6000
        },
        "request_sha256": "a8b0c8fceaa584f7b30d4b7a9214212603e11bfee07dc5cf6e724c50c724f9c3",
        "response_id": "chatcmpl-EbbEtnzkcl7ULCQY1enD5xPF47hh4",
        "generated_at": "2026-10-22T00:46:31+00:00",
        "usage": {
          "completion_tokens": 845,
          "prompt_tokens": 981,
          "total_tokens": 1826,
          "completion_tokens_details": {
            "accepted_prediction_tokens": 0,
            "audio_tokens": 0,
            "reasoning_tokens": 0,
            "rejected_prediction_tokens": 0
          },
          "prompt_tokens_details": {
            "audio_tokens": 0,
            "cached_tokens": 0
          },
          "latency_checkpoint": {
            "engine_tbt_ms": 9,
            "engine_ttft_ms": 69,
            "engine_ttlt_ms": 7365,
            "pre_inference_ms": 106,
            "service_tbt_ms": 9,
            "service_ttft_ms": 404,
            "service_ttlt_ms": 7685,
            "user_visible_ttft_ms": 298
          }
        },
        "generation_artifacts": "results/synthetic-translations-p_5iw50i/zh-en-contemporary-038",
        "task_id": "9084838415934ccab1353b36106181bf80966540cd084282dac4f8b8f3c560e9",
        "source_revision": 1,
        "source_sha256": "5390ca0c41a9302eeba74c2a101769151830dec72ab6127482030e934712c861",
        "translation_sha256": "188b954f29c0cc5be6c400966114830367bc5732edc26d975ad72fe336d6b8b5",
        "usage_rights": "permitted",
        "attribution": "Chinese source: 破壁行动; author: Meltyland Nightmare; https://scp-cn.wiki/wallisbroken. Synthetic English translation generated with azure/openai/gpt-4.1-mini.",
        "license": "CC BY-SA 3.0",
        "license_url": "https://creativecommons.org/licenses/by-sa/3.0/"
      }
    }
  ],
  "translation_instructions": null
}
