{
  "schema_version": 2,
  "case_id": "zh-en-contemporary-019",
  "revision": 1,
  "status": "ready",
  "task": "literary-translation-quality",
  "source_language": "zh",
  "target_language": "en",
  "source_file": "../../../fixtures/manuscripts/contemporary-myselfborn/passage-019/source.zh.txt",
  "source_metadata_file": "../../../fixtures/manuscripts/contemporary-myselfborn/passage-019/passage.json",
  "source_revision": 1,
  "group_id": "contemporary-myselfborn",
  "passage_id": "contemporary-myselfborn-passage-019",
  "rubric_id": "literary-translation-quality-v1",
  "context": {
    "brief": null
  },
  "candidates": [
    {
      "candidate_id": "c-5c58c629927d4dba",
      "revision": 1,
      "translation_file": "candidates/c-5c58c629927d4dba.en.txt",
      "status": "ready",
      "provenance": {
        "usage_rights": "permitted",
        "license": "CC BY-SA 3.0",
        "license_url": "https://creativecommons.org/licenses/by-sa/3.0/",
        "attribution": "割裂二生 / The Fragmented Two Lives, by jimmy stick. Translation: Not separately named in the retrieved credit box; see linked English page history and retained credits. CC BY-SA 3.0. Sources: https://scp-cn.wiki/myselfborn and https://scp-int.wikidot.com/myselfborn.",
        "license_evidence": "CC BY-SA 3.0 link found on both retrieved source pages; original HTML retained in source_cache.",
        "corpus_collection": "contemporary_corpus",
        "corpus_record_id": "contemporary-019",
        "source_work_id": "myselfborn",
        "retrieved_date": "2026-10-19",
        "modifications": "Imported verbatim from contemporary_pairs.jsonl; no additional wording or normalization changes.",
        "translation_origin": "published English translation",
        "translator": "Not separately named in the retrieved credit box; see linked English page history and retained credits.",
        "title_en": "The Fragmented Two Lives",
        "source_url": "https://scp-int.wikidot.com/myselfborn",
        "english_history_url": "https://scp-int.wikidot.com/myselfborn/history",
        "source_credits": [],
        "source_snapshot_sha256": "8baf9a0af14ba7ffed4ca0500ce6289de19b2b73201e597f0e6e3e3373c5b536",
        "extracted_block_range_exclusive": [
          9,
          56
        ],
        "english_word_count": 693,
        "selection_type": "complete_scene_or_story",
        "corpus_review": {
          "reviewer": "Codex (AI)",
          "date": "2026-10-19",
          "boundary_rationale": "A recollection of loss leads through workplace exclusion to the character's transfer, completing that phase of the story.",
          "alignment": "Passage-level alignment of the published translation with its Chinese original. Not a sentence-aligned or human-certified corpus.",
          "normalization": "HTML removed; paragraph and scene breaks preserved; credit widgets, navigation and footnote markers excluded. Source wording retained, including translation quirks. Unrendered formatting/image directives omitted; no images collected.",
          "context": "An excerpt may use characters and terms established elsewhere in the source or SCP shared universe."
        }
      }
    },
    {
      "candidate_id": "c-d1b490b977e44102",
      "revision": 1,
      "translation_file": "candidates/c-d1b490b977e44102.en.txt",
      "status": "ready",
      "provenance": {
        "translation_origin": "synthetic model translation",
        "purpose": "minimal-prompt adverse-candidate pool",
        "quality_status": "unreviewed; degradation is not assumed",
        "requested_model": "azure/openai/gpt-4.1-mini",
        "returned_model": "azure/openai/gpt-4.1-mini",
        "non_reasoning_model": true,
        "instruction": "translate the Chinese to English",
        "generation_settings": {
          "temperature": 0,
          "max_tokens": 6000
        },
        "request_sha256": "dfd37d1da17fb090c744c31ca64eac77f5a85809e36b89e9dd19929dca9af4e1",
        "response_id": "chatcmpl-EbbECEHzyJMMwqHS1L80U38OzQ68l",
        "generated_at": "2026-10-22T00:45:48+00:00",
        "usage": {
          "completion_tokens": 887,
          "prompt_tokens": 1037,
          "total_tokens": 1924,
          "completion_tokens_details": {
            "accepted_prediction_tokens": 0,
            "audio_tokens": 0,
            "reasoning_tokens": 0,
            "rejected_prediction_tokens": 0
          },
          "prompt_tokens_details": {
            "audio_tokens": 0,
            "cached_tokens": 0
          },
          "latency_checkpoint": {
            "engine_tbt_ms": 7,
            "engine_ttft_ms": 34,
            "engine_ttlt_ms": 6610,
            "pre_inference_ms": 300,
            "service_tbt_ms": 7,
            "service_ttft_ms": 674,
            "service_ttlt_ms": 7244,
            "user_visible_ttft_ms": 374
          }
        },
        "generation_artifacts": "results/synthetic-translations-p_5iw50i/zh-en-contemporary-019",
        "task_id": "26af6767c44189b9b6bf09bf9fc32d7a9ea304f7ae4fa57fc3766970313adf13",
        "source_revision": 1,
        "source_sha256": "f6737fb91fcdaa04ed9e571eb3f1dca5de73f69bcb5ba0ebb3d079970d0e4f1b",
        "translation_sha256": "f94d3d1591bb8b22218c1dbb27051b7dd0f3ce77418a36fce7d34eb0dc975eae",
        "usage_rights": "permitted",
        "attribution": "Chinese source: 割裂二生; author: jimmy stick; https://scp-cn.wiki/myselfborn. Synthetic English translation generated with azure/openai/gpt-4.1-mini.",
        "license": "CC BY-SA 3.0",
        "license_url": "https://creativecommons.org/licenses/by-sa/3.0/"
      }
    }
  ],
  "translation_instructions": null
}
