{
  "schema_version": 2,
  "case_id": "zh-en-contemporary-009",
  "revision": 1,
  "status": "ready",
  "task": "literary-translation-quality",
  "source_language": "zh",
  "target_language": "en",
  "source_file": "../../../fixtures/manuscripts/contemporary-goc-tale-ke-fou-zhi-shi-cai-pai/passage-009/source.zh.txt",
  "source_metadata_file": "../../../fixtures/manuscripts/contemporary-goc-tale-ke-fou-zhi-shi-cai-pai/passage-009/passage.json",
  "source_revision": 1,
  "group_id": "contemporary-goc-tale-ke-fou-zhi-shi-cai-pai",
  "passage_id": "contemporary-goc-tale-ke-fou-zhi-shi-cai-pai-passage-009",
  "rubric_id": "literary-translation-quality-v1",
  "context": {
    "brief": null
  },
  "candidates": [
    {
      "candidate_id": "c-24671f76a88547d8",
      "revision": 1,
      "translation_file": "candidates/c-24671f76a88547d8.en.txt",
      "status": "ready",
      "provenance": {
        "translation_origin": "synthetic model translation",
        "purpose": "minimal-prompt adverse-candidate pool",
        "quality_status": "unreviewed; degradation is not assumed",
        "requested_model": "azure/openai/gpt-4.1-mini",
        "returned_model": "azure/openai/gpt-4.1-mini",
        "non_reasoning_model": true,
        "instruction": "translate the Chinese to English",
        "generation_settings": {
          "temperature": 0,
          "max_tokens": 6000
        },
        "request_sha256": "6fc090545b47ef2a020048a48d6902abf52daa2d75e643b9f2930ec92b361fa5",
        "response_id": "chatcmpl-EbbDqQy34rGKkMvuEE87YSMjFv8Wl",
        "generated_at": "2026-10-22T00:45:26+00:00",
        "usage": {
          "completion_tokens": 969,
          "prompt_tokens": 1178,
          "total_tokens": 2147,
          "completion_tokens_details": {
            "accepted_prediction_tokens": 0,
            "audio_tokens": 0,
            "reasoning_tokens": 0,
            "rejected_prediction_tokens": 0
          },
          "prompt_tokens_details": {
            "audio_tokens": 0,
            "cached_tokens": 0
          },
          "latency_checkpoint": {
            "engine_tbt_ms": 7,
            "engine_ttft_ms": 31,
            "engine_ttlt_ms": 6437,
            "pre_inference_ms": 101,
            "service_tbt_ms": 7,
            "service_ttft_ms": 276,
            "service_ttlt_ms": 6640,
            "user_visible_ttft_ms": 175
          }
        },
        "generation_artifacts": "results/synthetic-translations-p_5iw50i/zh-en-contemporary-009",
        "task_id": "6528003dd313725bd0b029b135e80382386c78b5f8df23a5057af39a21179f63",
        "source_revision": 1,
        "source_sha256": "ff31a4eb67b9ec1f976c1eec821cee8e1329c83f04d10d30e8ee63b5f8793ad5",
        "translation_sha256": "a683e65d9b513a7c0942d6215d6f9eac1a11d1c5a05fb7e5dec9ccd0580fccbc",
        "usage_rights": "permitted",
        "attribution": "Chinese source: 可否当上次遇见只是一场彩排; author: Agent Phage; https://scp-cn.wiki/goc-tale-ke-fou-zhi-shi-cai-pai. Synthetic English translation generated with azure/openai/gpt-4.1-mini.",
        "license": "CC BY-SA 3.0",
        "license_url": "https://creativecommons.org/licenses/by-sa/3.0/"
      }
    },
    {
      "candidate_id": "c-d23a1f54627a4795",
      "revision": 1,
      "translation_file": "candidates/c-d23a1f54627a4795.en.txt",
      "status": "ready",
      "provenance": {
        "usage_rights": "permitted",
        "license": "CC BY-SA 3.0",
        "license_url": "https://creativecommons.org/licenses/by-sa/3.0/",
        "attribution": "可否当上次遇见只是一场彩排 / Can Our Previous Meeting Just Be a Dress Rehearsal?, by Agent Phage. Translation: Not separately named in the retrieved credit box; see linked English page history and retained credits. CC BY-SA 3.0. Sources: https://scp-cn.wiki/goc-tale-ke-fou-zhi-shi-cai-pai and https://scp-int.wikidot.com/goc-tale-ke-fou-zhi-shi-cai-pai.",
        "license_evidence": "CC BY-SA 3.0 link found on both retrieved source pages; original HTML retained in source_cache.",
        "corpus_collection": "contemporary_corpus",
        "corpus_record_id": "contemporary-009",
        "source_work_id": "goc-tale-ke-fou-zhi-shi-cai-pai",
        "retrieved_date": "2026-10-19",
        "modifications": "Imported verbatim from contemporary_pairs.jsonl; no additional wording or normalization changes.",
        "translation_origin": "published English translation",
        "translator": "Not separately named in the retrieved credit box; see linked English page history and retained credits.",
        "title_en": "Can Our Previous Meeting Just Be a Dress Rehearsal?",
        "source_url": "https://scp-int.wikidot.com/goc-tale-ke-fou-zhi-shi-cai-pai",
        "english_history_url": "https://scp-int.wikidot.com/goc-tale-ke-fou-zhi-shi-cai-pai/history",
        "source_credits": [
          "rating: +2 + – x",
          "著作信息 Author: Agent Phage ; see more works by this author at their personnel dossier . Hope everyone enjoys. rating: +2 + – x"
        ],
        "source_snapshot_sha256": "a460c605cd8a3eb6b0ed5c4622d2873dea1bd5a98a7c1abaf09b06304890c892",
        "extracted_block_range_exclusive": [
          0,
          23
        ],
        "english_word_count": 697,
        "selection_type": "complete_scene_or_story",
        "corpus_review": {
          "reviewer": "Codex (AI)",
          "date": "2026-10-19",
          "boundary_rationale": "The rooftop conversation frames a complete recalled encounter ending with taking the offered hand.",
          "alignment": "Passage-level alignment of the published translation with its Chinese original. Not a sentence-aligned or human-certified corpus.",
          "normalization": "HTML removed; paragraph and scene breaks preserved; credit widgets, navigation and footnote markers excluded. Source wording retained, including translation quirks. Unrendered formatting/image directives omitted; no images collected.",
          "context": "An excerpt may use characters and terms established elsewhere in the source or SCP shared universe."
        }
      }
    }
  ],
  "translation_instructions": null
}
