{
  "schema_version": 2,
  "case_id": "zh-en-contemporary-007",
  "revision": 1,
  "status": "ready",
  "task": "literary-translation-quality",
  "source_language": "zh",
  "target_language": "en",
  "source_file": "../../../fixtures/manuscripts/contemporary-falling-into-stars/passage-007/source.zh.txt",
  "source_metadata_file": "../../../fixtures/manuscripts/contemporary-falling-into-stars/passage-007/passage.json",
  "source_revision": 1,
  "group_id": "contemporary-falling-into-stars",
  "passage_id": "contemporary-falling-into-stars-passage-007",
  "rubric_id": "literary-translation-quality-v1",
  "context": {
    "brief": null
  },
  "candidates": [
    {
      "candidate_id": "c-147deb5ed630460c",
      "revision": 1,
      "translation_file": "candidates/c-147deb5ed630460c.en.txt",
      "status": "ready",
      "provenance": {
        "translation_origin": "synthetic model translation",
        "purpose": "minimal-prompt adverse-candidate pool",
        "quality_status": "unreviewed; degradation is not assumed",
        "requested_model": "azure/openai/gpt-4.1-mini",
        "returned_model": "azure/openai/gpt-4.1-mini",
        "non_reasoning_model": true,
        "instruction": "translate the Chinese to English",
        "generation_settings": {
          "temperature": 0,
          "max_tokens": 6000
        },
        "request_sha256": "b070172f31dbf22e192ef9358f9114ddaabbddef67d79b12b9f9ac46406f8968",
        "response_id": "chatcmpl-EbbDlboz3UrQU2OIfrGhZm3qyYCTC",
        "generated_at": "2026-10-22T00:45:21+00:00",
        "usage": {
          "completion_tokens": 673,
          "prompt_tokens": 799,
          "total_tokens": 1472,
          "completion_tokens_details": {
            "accepted_prediction_tokens": 0,
            "audio_tokens": 0,
            "reasoning_tokens": 0,
            "rejected_prediction_tokens": 0
          },
          "prompt_tokens_details": {
            "audio_tokens": 0,
            "cached_tokens": 0
          },
          "latency_checkpoint": {
            "engine_tbt_ms": 7,
            "engine_ttft_ms": 33,
            "engine_ttlt_ms": 5050,
            "pre_inference_ms": 128,
            "service_tbt_ms": 7,
            "service_ttft_ms": 237,
            "service_ttlt_ms": 5249,
            "user_visible_ttft_ms": 109
          }
        },
        "generation_artifacts": "results/synthetic-translations-p_5iw50i/zh-en-contemporary-007",
        "task_id": "0e4ef42f4d7cd4dee96f1f8a876e73667a981cc731a0be92a7311c884e6dcda9",
        "source_revision": 1,
        "source_sha256": "c178f19baa07debbbce2cd5ed6142b7dc5d47dbcc01185e2d815e30241516ebc",
        "translation_sha256": "458c1ab6af0136cdd53faca0dccb74588525b3c4ffc53874f87f3dc0f676a8ba",
        "usage_rights": "permitted",
        "attribution": "Chinese source: 坠星者; author: Lyrics Linn; https://scp-cn.wiki/falling-into-stars. Synthetic English translation generated with azure/openai/gpt-4.1-mini.",
        "license": "CC BY-SA 3.0",
        "license_url": "https://creativecommons.org/licenses/by-sa/3.0/"
      }
    },
    {
      "candidate_id": "c-29b69f2071954dc2",
      "revision": 1,
      "translation_file": "candidates/c-29b69f2071954dc2.en.txt",
      "status": "ready",
      "provenance": {
        "usage_rights": "permitted",
        "license": "CC BY-SA 3.0",
        "license_url": "https://creativecommons.org/licenses/by-sa/3.0/",
        "attribution": "坠星者 / Falling Into Stars, by Lyrics Linn. Translation: Jochoi; translation assistance: A Lancelot and Star Lyn CC BY-SA 3.0. Sources: https://scp-cn.wiki/falling-into-stars and https://scp-int.wikidot.com/falling-into-stars.",
        "license_evidence": "CC BY-SA 3.0 link found on both retrieved source pages; original HTML retained in source_cache.",
        "corpus_collection": "contemporary_corpus",
        "corpus_record_id": "contemporary-007",
        "source_work_id": "falling-into-stars",
        "retrieved_date": "2026-10-19",
        "modifications": "Imported verbatim from contemporary_pairs.jsonl; no additional wording or normalization changes.",
        "translation_origin": "published English translation",
        "translator": "Jochoi; translation assistance: A Lancelot and Star Lyn",
        "title_en": "Falling Into Stars",
        "source_url": "https://scp-int.wikidot.com/falling-into-stars",
        "english_history_url": "https://scp-int.wikidot.com/falling-into-stars/history",
        "source_credits": [
          "rating: +12 + – x  close Info X Falling Into Stars Date of Publish: 2018-9-27 Author: Lyrics Linn , go to her personnel file for more work from this author Translator : Jochoi Translation assistance : A Lancelot , Star Lyn rating: +12 + – x",
          "close Info X Falling Into Stars Date of Publish: 2018-9-27 Author: Lyrics Linn , go to her personnel file for more work from this author Translator : Jochoi Translation assistance : A Lancelot , Star Lyn rating: +12 + – x"
        ],
        "source_snapshot_sha256": "84a7428ece0c114a1880e71e25b927d340ee86f8853ac06120a17adf862464d0",
        "extracted_block_range_exclusive": [
          176,
          205
        ],
        "english_word_count": 553,
        "selection_type": "complete_scene_or_story",
        "corpus_review": {
          "reviewer": "Codex (AI)",
          "date": "2026-10-19",
          "boundary_rationale": "Bright receives a new body and a ship, chooses a name, and departs: the complete closing sequence.",
          "alignment": "Passage-level alignment of the published translation with its Chinese original. Not a sentence-aligned or human-certified corpus.",
          "normalization": "HTML removed; paragraph and scene breaks preserved; credit widgets, navigation and footnote markers excluded. Source wording retained, including translation quirks. Unrendered formatting/image directives omitted; no images collected.",
          "context": "An excerpt may use characters and terms established elsewhere in the source or SCP shared universe."
        }
      }
    }
  ],
  "translation_instructions": null
}
