{
  "schema_version": 2,
  "case_id": "zh-en-contemporary-039",
  "revision": 1,
  "status": "ready",
  "task": "literary-translation-quality",
  "source_language": "zh",
  "target_language": "en",
  "source_file": "../../../fixtures/manuscripts/contemporary-sayonara-hatsukoi/passage-039/source.zh.txt",
  "source_metadata_file": "../../../fixtures/manuscripts/contemporary-sayonara-hatsukoi/passage-039/passage.json",
  "source_revision": 1,
  "group_id": "contemporary-sayonara-hatsukoi",
  "passage_id": "contemporary-sayonara-hatsukoi-passage-039",
  "rubric_id": "literary-translation-quality-v1",
  "context": {
    "brief": null
  },
  "candidates": [
    {
      "candidate_id": "c-32e89317148544e2",
      "revision": 1,
      "translation_file": "candidates/c-32e89317148544e2.en.txt",
      "status": "ready",
      "provenance": {
        "translation_origin": "synthetic model translation",
        "purpose": "minimal-prompt adverse-candidate pool",
        "quality_status": "unreviewed; degradation is not assumed",
        "requested_model": "azure/openai/gpt-4.1-mini",
        "returned_model": "azure/openai/gpt-4.1-mini",
        "non_reasoning_model": true,
        "instruction": "translate the Chinese to English",
        "generation_settings": {
          "temperature": 0,
          "max_tokens": 6000
        },
        "request_sha256": "280533aca3c064b84f3421006c46f277d3ec973bec6937fd91fed42ae6094255",
        "response_id": "chatcmpl-EbbEt2pjdVWgfV1yJ3RjoIzQg4Ytm",
        "generated_at": "2026-10-22T00:46:31+00:00",
        "usage": {
          "completion_tokens": 979,
          "prompt_tokens": 1144,
          "total_tokens": 2123,
          "completion_tokens_details": {
            "accepted_prediction_tokens": 0,
            "audio_tokens": 0,
            "reasoning_tokens": 0,
            "rejected_prediction_tokens": 0
          },
          "prompt_tokens_details": {
            "audio_tokens": 0,
            "cached_tokens": 0
          },
          "latency_checkpoint": {
            "engine_tbt_ms": 6,
            "engine_ttft_ms": 33,
            "engine_ttlt_ms": 6112,
            "pre_inference_ms": 158,
            "service_tbt_ms": 6,
            "service_ttft_ms": 290,
            "service_ttlt_ms": 6346,
            "user_visible_ttft_ms": 132
          }
        },
        "generation_artifacts": "results/synthetic-translations-p_5iw50i/zh-en-contemporary-039",
        "task_id": "15009a4c8709491335d8424243fdb33ce36dde429a81ae3fef4604f32c6fe0b7",
        "source_revision": 1,
        "source_sha256": "9264088eca18147011514eec1e9f776b17f245fe38d5aa86c492509948ec859c",
        "translation_sha256": "036aee7afdfb601a7411f3eb58ac40555f1bc1fc696ce9da0d213efdca115b18",
        "usage_rights": "permitted",
        "attribution": "Chinese source: 再见了，箱中的巫魔少女; author: Ninth BB; https://scp-cn.wiki/sayonara-hatsukoi. Synthetic English translation generated with azure/openai/gpt-4.1-mini.",
        "license": "CC BY-SA 3.0",
        "license_url": "https://creativecommons.org/licenses/by-sa/3.0/"
      }
    },
    {
      "candidate_id": "c-8e99e3ab668345f2",
      "revision": 1,
      "translation_file": "candidates/c-8e99e3ab668345f2.en.txt",
      "status": "ready",
      "provenance": {
        "usage_rights": "permitted",
        "license": "CC BY-SA 3.0",
        "license_url": "https://creativecommons.org/licenses/by-sa/3.0/",
        "attribution": "再见了，箱中的巫魔少女 / Farewell, the Witch Girl of the Box, by Ninth BB. Translation: Not separately named in the retrieved credit box; see linked English page history and retained credits. CC BY-SA 3.0. Sources: https://scp-cn.wiki/sayonara-hatsukoi and https://scp-int.wikidot.com/sayonara-hatsukoi.",
        "license_evidence": "CC BY-SA 3.0 link found on both retrieved source pages; original HTML retained in source_cache.",
        "corpus_collection": "contemporary_corpus",
        "corpus_record_id": "contemporary-039",
        "source_work_id": "sayonara-hatsukoi",
        "retrieved_date": "2026-10-19",
        "modifications": "Imported verbatim from contemporary_pairs.jsonl; no additional wording or normalization changes.",
        "translation_origin": "published English translation",
        "translator": "Not separately named in the retrieved credit box; see linked English page history and retained credits.",
        "title_en": "Farewell, the Witch Girl of the Box",
        "source_url": "https://scp-int.wikidot.com/sayonara-hatsukoi",
        "english_history_url": "https://scp-int.wikidot.com/sayonara-hatsukoi/history",
        "source_credits": [
          "rating: -1 + – x  close Info X Farewell, the Witch Girl of the Box Author: Ninth BB Time, locations, characters, events, plots and other content of the article are all fictional, irrelevant to real people and events. Any resemblance is purely coincidental. Illustration drawn by Bilibili user 【寐言hpyer】, artist’s page CC-licensed. rating: -1 + – x",
          "close Info X Farewell, the Witch Girl of the Box Author: Ninth BB Time, locations, characters, events, plots and other content of the article are all fictional, irrelevant to real people and events. Any resemblance is purely coincidental. Illustration drawn by Bilibili user 【寐言hpyer】, artist’s page CC-licensed. rating: -1 + – x"
        ],
        "source_snapshot_sha256": "02ed6486681e2065642b9fdc211eed898404e0a3451fcb1bde3fb463d5014861",
        "extracted_block_range_exclusive": [
          0,
          27
        ],
        "english_word_count": 671,
        "selection_type": "complete_scene_or_story",
        "corpus_review": {
          "reviewer": "Codex (AI)",
          "date": "2026-10-19",
          "boundary_rationale": "The dream-world opening and the conversation terminating sedation complete the first movement.",
          "alignment": "Passage-level alignment of the published translation with its Chinese original. Not a sentence-aligned or human-certified corpus.",
          "normalization": "HTML removed; paragraph and scene breaks preserved; credit widgets, navigation and footnote markers excluded. Source wording retained, including translation quirks. Unrendered formatting/image directives omitted; no images collected.",
          "context": "An excerpt may use characters and terms established elsewhere in the source or SCP shared universe."
        }
      }
    }
  ],
  "translation_instructions": null
}
