{
  "schema_version": 2,
  "case_id": "zh-en-contemporary-016",
  "revision": 1,
  "status": "ready",
  "task": "literary-translation-quality",
  "source_language": "zh",
  "target_language": "en",
  "source_file": "../../../fixtures/manuscripts/contemporary-kawaii-o5-3/passage-016/source.zh.txt",
  "source_metadata_file": "../../../fixtures/manuscripts/contemporary-kawaii-o5-3/passage-016/passage.json",
  "source_revision": 1,
  "group_id": "contemporary-kawaii-o5-3",
  "passage_id": "contemporary-kawaii-o5-3-passage-016",
  "rubric_id": "literary-translation-quality-v1",
  "context": {
    "brief": null
  },
  "candidates": [
    {
      "candidate_id": "c-83144a32ffd04235",
      "revision": 1,
      "translation_file": "candidates/c-83144a32ffd04235.en.txt",
      "status": "ready",
      "provenance": {
        "translation_origin": "synthetic model translation",
        "purpose": "minimal-prompt adverse-candidate pool",
        "quality_status": "unreviewed; degradation is not assumed",
        "requested_model": "azure/openai/gpt-4.1-mini",
        "returned_model": "azure/openai/gpt-4.1-mini",
        "non_reasoning_model": true,
        "instruction": "translate the Chinese to English",
        "generation_settings": {
          "temperature": 0,
          "max_tokens": 6000
        },
        "request_sha256": "322e63007ee0b69f9f0c659df4a15ac15b1ab22b6e5296176168cd5c3948da73",
        "response_id": "chatcmpl-EbbE5bW8XrzH1PbZjf8nfuRlLtLrb",
        "generated_at": "2026-10-22T00:45:41+00:00",
        "usage": {
          "completion_tokens": 791,
          "prompt_tokens": 913,
          "total_tokens": 1704,
          "completion_tokens_details": {
            "accepted_prediction_tokens": 0,
            "audio_tokens": 0,
            "reasoning_tokens": 0,
            "rejected_prediction_tokens": 0
          },
          "prompt_tokens_details": {
            "audio_tokens": 0,
            "cached_tokens": 0
          },
          "latency_checkpoint": {
            "engine_tbt_ms": 7,
            "engine_ttft_ms": 46,
            "engine_ttlt_ms": 5205,
            "pre_inference_ms": 102,
            "service_tbt_ms": 6,
            "service_ttft_ms": 459,
            "service_ttlt_ms": 5548,
            "user_visible_ttft_ms": 356
          }
        },
        "generation_artifacts": "results/synthetic-translations-p_5iw50i/zh-en-contemporary-016",
        "task_id": "92c73031d7241539c37996d9482e349b5a5415b26167de220fb10e3c254d4368",
        "source_revision": 1,
        "source_sha256": "71e58f081a8315f519a4930bb6136e4d189af0a7803de6c18f80a44b962f7063",
        "translation_sha256": "9e5ed349ebb42dd79f4c93bba974dd0cac39a9156e0d6b8d5c3b4562a3fab200",
        "usage_rights": "permitted",
        "attribution": "Chinese source: O5-3实在太烧辣; author: OxygenNine; https://scp-cn.wiki/kawaii-o5-3. Synthetic English translation generated with azure/openai/gpt-4.1-mini.",
        "license": "CC BY-SA 3.0",
        "license_url": "https://creativecommons.org/licenses/by-sa/3.0/"
      }
    },
    {
      "candidate_id": "c-8b284b9356dd465e",
      "revision": 1,
      "translation_file": "candidates/c-8b284b9356dd465e.en.txt",
      "status": "ready",
      "provenance": {
        "usage_rights": "permitted",
        "license": "CC BY-SA 3.0",
        "license_url": "https://creativecommons.org/licenses/by-sa/3.0/",
        "attribution": "O5-3实在太烧辣 / O5-3 Is Too Hot, by OxygenNine. Translation: Not separately named in the retrieved credit box; see linked English page history and retained credits. CC BY-SA 3.0. Sources: https://scp-cn.wiki/kawaii-o5-3 and http://scp-int.wikidot.com/kawaii-o5-3.",
        "license_evidence": "CC BY-SA 3.0 link found on both retrieved source pages; original HTML retained in source_cache.",
        "corpus_collection": "contemporary_corpus",
        "corpus_record_id": "contemporary-016",
        "source_work_id": "kawaii-o5-3",
        "retrieved_date": "2026-10-19",
        "modifications": "Imported verbatim from contemporary_pairs.jsonl; no additional wording or normalization changes.",
        "translation_origin": "published English translation",
        "translator": "Not separately named in the retrieved credit box; see linked English page history and retained credits.",
        "title_en": "O5-3 Is Too Hot",
        "source_url": "http://scp-int.wikidot.com/kawaii-o5-3",
        "english_history_url": "http://scp-int.wikidot.com/kawaii-o5-3/history",
        "source_credits": [],
        "source_snapshot_sha256": "26dab3843013ab1f0b1613c2aea5c8a4cd2b3022dfafd18e5685459941e8ae8c",
        "extracted_block_range_exclusive": [
          49,
          64
        ],
        "english_word_count": 661,
        "selection_type": "complete_scene_or_story",
        "corpus_review": {
          "reviewer": "Codex (AI)",
          "date": "2026-10-19",
          "boundary_rationale": "The complete launch-and-success episode of the virtual idol project.",
          "alignment": "Passage-level alignment of the published translation with its Chinese original. Not a sentence-aligned or human-certified corpus.",
          "normalization": "HTML removed; paragraph and scene breaks preserved; credit widgets, navigation and footnote markers excluded. Source wording retained, including translation quirks. Unrendered formatting/image directives omitted; no images collected.",
          "context": "An excerpt may use characters and terms established elsewhere in the source or SCP shared universe."
        }
      }
    }
  ],
  "translation_instructions": null
}
