{
  "schema_version": 2,
  "case_id": "zh-en-contemporary-014",
  "revision": 1,
  "status": "ready",
  "task": "literary-translation-quality",
  "source_language": "zh",
  "target_language": "en",
  "source_file": "../../../fixtures/manuscripts/contemporary-honour-of-die/passage-014/source.zh.txt",
  "source_metadata_file": "../../../fixtures/manuscripts/contemporary-honour-of-die/passage-014/passage.json",
  "source_revision": 1,
  "group_id": "contemporary-honour-of-die",
  "passage_id": "contemporary-honour-of-die-passage-014",
  "rubric_id": "literary-translation-quality-v1",
  "context": {
    "brief": null
  },
  "candidates": [
    {
      "candidate_id": "c-06a7d9bdc65747eb",
      "revision": 1,
      "translation_file": "candidates/c-06a7d9bdc65747eb.en.txt",
      "status": "ready",
      "provenance": {
        "usage_rights": "permitted",
        "license": "CC BY-SA 3.0",
        "license_url": "https://creativecommons.org/licenses/by-sa/3.0/",
        "attribution": "荣光之陨 / Honour Of Die, by Adeptus Custodes. Translation: Not separately named in the retrieved credit box; see linked English page history and retained credits. CC BY-SA 3.0. Sources: https://scp-cn.wiki/honour-of-die and https://scp-int.wikidot.com/honour-of-die.",
        "license_evidence": "CC BY-SA 3.0 link found on both retrieved source pages; original HTML retained in source_cache.",
        "corpus_collection": "contemporary_corpus",
        "corpus_record_id": "contemporary-014",
        "source_work_id": "honour-of-die",
        "retrieved_date": "2026-10-19",
        "modifications": "Imported verbatim from contemporary_pairs.jsonl; no additional wording or normalization changes.",
        "translation_origin": "published English translation",
        "translator": "Not separately named in the retrieved credit box; see linked English page history and retained credits.",
        "title_en": "Honour Of Die",
        "source_url": "https://scp-int.wikidot.com/honour-of-die",
        "english_history_url": "https://scp-int.wikidot.com/honour-of-die/history",
        "source_credits": [],
        "source_snapshot_sha256": "606242cd35e80ce0807c11e5d8fa68ed4257eb7a6c00ed3d5adde10b7da3835c",
        "extracted_block_range_exclusive": [
          154,
          168
        ],
        "english_word_count": 605,
        "selection_type": "complete_scene_or_story",
        "corpus_review": {
          "reviewer": "Codex (AI)",
          "date": "2026-10-19",
          "boundary_rationale": "The narrator enters the theatre and discovers LG's body; the scene closes with a reflection on death.",
          "alignment": "Passage-level alignment of the published translation with its Chinese original. Not a sentence-aligned or human-certified corpus.",
          "normalization": "HTML removed; paragraph and scene breaks preserved; credit widgets, navigation and footnote markers excluded. Source wording retained, including translation quirks. Unrendered formatting/image directives omitted; no images collected.",
          "context": "An excerpt may use characters and terms established elsewhere in the source or SCP shared universe."
        }
      }
    },
    {
      "candidate_id": "c-d8b620d9b5ce40c3",
      "revision": 1,
      "translation_file": "candidates/c-d8b620d9b5ce40c3.en.txt",
      "status": "ready",
      "provenance": {
        "translation_origin": "synthetic model translation",
        "purpose": "minimal-prompt adverse-candidate pool",
        "quality_status": "unreviewed; degradation is not assumed",
        "requested_model": "openai/openai/gpt-4o-mini",
        "returned_model": "openai/openai/gpt-4o-mini",
        "non_reasoning_model": true,
        "instruction": "translate the Chinese to English",
        "generation_settings": {
          "temperature": 0,
          "max_tokens": 6000
        },
        "request_sha256": "24189d1f2bd058ac8838b81f9a62a0ea2af3eacab904b18a2f963ed95a0638fd",
        "response_id": "resp_0bce0be3432dde67016ad95d67585887d1aa9ce7eb666ec321",
        "generated_at": "2026-10-22T00:48:39+00:00",
        "usage": {
          "completion_tokens": 701,
          "prompt_tokens": 903,
          "total_tokens": 1604,
          "completion_tokens_details": {
            "reasoning_tokens": 0
          },
          "prompt_tokens_details": {
            "cached_tokens": 0,
            "cache_write_tokens": 0,
            "cache_creation_tokens": 0
          }
        },
        "generation_artifacts": "results/synthetic-translations-r6irqyy1/zh-en-contemporary-014",
        "task_id": "dbdfd6a0989a642cdfed435021805424cc871b3e0ce879cc7e9088db7e4a0bdd",
        "source_revision": 1,
        "source_sha256": "fccf2560a441ea61e2a186626e1c1175438dd8169f79d561d05a3c2fed549286",
        "translation_sha256": "1ceff5ca9cec5466d45d610dbbd3aa3327cf68353717d72f39070f8754c2d310",
        "usage_rights": "permitted",
        "attribution": "Chinese source: 荣光之陨; author: Adeptus Custodes; https://scp-cn.wiki/honour-of-die. Synthetic English translation generated with openai/openai/gpt-4o-mini.",
        "license": "CC BY-SA 3.0",
        "license_url": "https://creativecommons.org/licenses/by-sa/3.0/"
      }
    }
  ],
  "translation_instructions": null
}
